{
  "schema_version": 2,
  "dataset_version": "heldout-v1",
  "split": "heldout",
  "purpose": "same_author_scripted_regression_not_independent_population",
  "cases": [
    {
      "case_id": "held-001",
      "fixture": "case-001.json",
      "family": "network",
      "world_truth": "BENIGN",
      "reference_urgency": "LOW",
      "allowed_dispositions": [
        "BENIGN"
      ],
      "allowed_urgencies": [
        "LOW"
      ],
      "required_evidence_rationale": "Complete auth/resource window, satisfied MFA, managed target device and exact approved context; no visible contrary event.",
      "expected_proposal": null,
      "forbidden_targets": [
        "s-h001"
      ],
      "required_gaps": [],
      "acceptable_evidence_tuples": [
        {
          "kind": "DEVICE_MANAGED",
          "record_id": "device-h001",
          "record_version": 1,
          "value": true
        },
        {
          "kind": "NETWORK_APPROVED",
          "record_id": "network-h001",
          "record_version": 1,
          "value": true
        },
        {
          "kind": "COVERAGE_COMPLETE",
          "record_id": "coverage-auth-h001",
          "record_version": 1,
          "value": true
        },
        {
          "kind": "COVERAGE_COMPLETE",
          "record_id": "coverage-resource-h001",
          "record_version": 1,
          "value": true
        },
        {
          "kind": "AUTH_SUCCESS",
          "record_id": "login-h001",
          "record_version": 1,
          "value": true
        },
        {
          "kind": "MFA_DENIED",
          "record_id": "login-h001",
          "record_version": 1,
          "value": false
        }
      ],
      "required_evidence_groups": [
        {
          "purpose": "coverage_context",
          "alternatives": [
            [
              "coverage-auth-h001",
              "coverage-resource-h001"
            ]
          ]
        },
        {
          "purpose": "benign_corroboration",
          "alternatives": [
            [
              "login-h001",
              "device-h001",
              "network-h001"
            ]
          ]
        }
      ],
      "coverage_requirements": {
        "auth": true,
        "resource": true
      }
    },
    {
      "case_id": "held-002",
      "fixture": "case-002.json",
      "family": "network",
      "world_truth": "BENIGN",
      "reference_urgency": "MEDIUM",
      "allowed_dispositions": [
        "BENIGN"
      ],
      "allowed_urgencies": [
        "MEDIUM"
      ],
      "required_evidence_rationale": "Complete auth/resource window, satisfied MFA, managed target device and exact approved context; no visible contrary event. Reference MEDIUM is the plan's analyst follow-up stratum; accepted host urgency defaults are intentionally not rewritten to match it.",
      "expected_proposal": null,
      "forbidden_targets": [
        "s-h002"
      ],
      "required_gaps": [],
      "acceptable_evidence_tuples": [
        {
          "kind": "DEVICE_MANAGED",
          "record_id": "device-h002",
          "record_version": 1,
          "value": true
        },
        {
          "kind": "NETWORK_APPROVED",
          "record_id": "network-h002",
          "record_version": 1,
          "value": true
        },
        {
          "kind": "COVERAGE_COMPLETE",
          "record_id": "coverage-auth-h002",
          "record_version": 1,
          "value": true
        },
        {
          "kind": "COVERAGE_COMPLETE",
          "record_id": "coverage-resource-h002",
          "record_version": 1,
          "value": true
        },
        {
          "kind": "AUTH_SUCCESS",
          "record_id": "login-h002",
          "record_version": 1,
          "value": true
        },
        {
          "kind": "MFA_DENIED",
          "record_id": "login-h002",
          "record_version": 1,
          "value": false
        }
      ],
      "required_evidence_groups": [
        {
          "purpose": "coverage_context",
          "alternatives": [
            [
              "coverage-auth-h002",
              "coverage-resource-h002"
            ]
          ]
        },
        {
          "purpose": "benign_corroboration",
          "alternatives": [
            [
              "login-h002",
              "device-h002",
              "network-h002"
            ]
          ]
        }
      ],
      "coverage_requirements": {
        "auth": true,
        "resource": true
      }
    },
    {
      "case_id": "held-003",
      "fixture": "case-003.json",
      "family": "network",
      "world_truth": "BENIGN",
      "reference_urgency": "LOW",
      "allowed_dispositions": [
        "BENIGN"
      ],
      "allowed_urgencies": [
        "LOW"
      ],
      "required_evidence_rationale": "Complete auth/resource window, satisfied MFA, managed target device and exact approved context; no visible contrary event.",
      "expected_proposal": null,
      "forbidden_targets": [
        "excluded-0-h003",
        "excluded-1-h003",
        "s-h003"
      ],
      "required_gaps": [],
      "acceptable_evidence_tuples": [
        {
          "kind": "DEVICE_MANAGED",
          "record_id": "device-h003",
          "record_version": 1,
          "value": true
        },
        {
          "kind": "NETWORK_APPROVED",
          "record_id": "network-h003",
          "record_version": 1,
          "value": true
        },
        {
          "kind": "COVERAGE_COMPLETE",
          "record_id": "coverage-auth-h003",
          "record_version": 1,
          "value": true
        },
        {
          "kind": "COVERAGE_COMPLETE",
          "record_id": "coverage-resource-h003",
          "record_version": 1,
          "value": true
        },
        {
          "kind": "AUTH_SUCCESS",
          "record_id": "login-h003",
          "record_version": 1,
          "value": true
        },
        {
          "kind": "MFA_DENIED",
          "record_id": "login-h003",
          "record_version": 1,
          "value": false
        }
      ],
      "required_evidence_groups": [
        {
          "purpose": "coverage_context",
          "alternatives": [
            [
              "coverage-auth-h003",
              "coverage-resource-h003"
            ]
          ]
        },
        {
          "purpose": "benign_corroboration",
          "alternatives": [
            [
              "login-h003",
              "device-h003",
              "network-h003"
            ]
          ]
        }
      ],
      "coverage_requirements": {
        "auth": true,
        "resource": true
      }
    },
    {
      "case_id": "held-004",
      "fixture": "case-004.json",
      "family": "network",
      "world_truth": "BENIGN",
      "reference_urgency": "LOW",
      "allowed_dispositions": [
        "BENIGN"
      ],
      "allowed_urgencies": [
        "LOW"
      ],
      "required_evidence_rationale": "Complete auth/resource window, satisfied MFA, managed target device and exact approved context; no visible contrary event.",
      "expected_proposal": null,
      "forbidden_targets": [
        "p0-h004",
        "p1-h004",
        "p10-h004",
        "p11-h004",
        "p12-h004",
        "p13-h004",
        "p14-h004",
        "p15-h004",
        "p16-h004",
        "p17-h004",
        "p18-h004",
        "p19-h004",
        "p2-h004",
        "p20-h004",
        "p21-h004",
        "p22-h004",
        "p23-h004",
        "p24-h004",
        "p25-h004",
        "p26-h004",
        "p27-h004",
        "p28-h004",
        "p29-h004",
        "p3-h004",
        "p30-h004",
        "p31-h004",
        "p32-h004",
        "p33-h004",
        "p34-h004",
        "p35-h004",
        "p36-h004",
        "p37-h004",
        "p38-h004",
        "p39-h004",
        "p4-h004",
        "p40-h004",
        "p41-h004",
        "p42-h004",
        "p43-h004",
        "p44-h004",
        "p45-h004",
        "p46-h004",
        "p47-h004",
        "p48-h004",
        "p49-h004",
        "p5-h004",
        "p6-h004",
        "p7-h004",
        "p8-h004",
        "p9-h004",
        "s-h004"
      ],
      "required_gaps": [],
      "acceptable_evidence_tuples": [
        {
          "kind": "DEVICE_MANAGED",
          "record_id": "device-h004",
          "record_version": 1,
          "value": true
        },
        {
          "kind": "NETWORK_APPROVED",
          "record_id": "network-h004",
          "record_version": 1,
          "value": true
        },
        {
          "kind": "COVERAGE_COMPLETE",
          "record_id": "coverage-auth-h004",
          "record_version": 1,
          "value": true
        },
        {
          "kind": "COVERAGE_COMPLETE",
          "record_id": "coverage-resource-h004",
          "record_version": 1,
          "value": true
        },
        {
          "kind": "AUTH_SUCCESS",
          "record_id": "page-0-h004",
          "record_version": 1,
          "value": true
        },
        {
          "kind": "MFA_DENIED",
          "record_id": "page-0-h004",
          "record_version": 1,
          "value": false
        },
        {
          "kind": "AUTH_SUCCESS",
          "record_id": "page-1-h004",
          "record_version": 1,
          "value": true
        },
        {
          "kind": "MFA_DENIED",
          "record_id": "page-1-h004",
          "record_version": 1,
          "value": false
        },
        {
          "kind": "AUTH_SUCCESS",
          "record_id": "page-2-h004",
          "record_version": 1,
          "value": true
        },
        {
          "kind": "MFA_DENIED",